{
  "kind": "assignment",
  "schema_version": "0.1.0",
  "source": {
    "uri": "urn:fixture:synthetic-assignment",
    "revision": "assignment-v1",
    "observed_at": "2026-09-05T00:00:00Z"
  },
  "task_ref": {
    "uri": "urn:fixture:task-envelope",
    "revision": "revision-1",
    "observed_at": "2026-09-05T00:00:00Z"
  },
  "task_id": "fixture-label",
  "task_revision": "revision-1",
  "run_id": "example-run-1",
  "producer": {
    "role": "implementation-worker",
    "instance_id": "writer-1"
  },
  "attempt_id": "example-attempt-1",
  "ownership_epoch": 1,
  "base_ref": "snapshot:example-base-1",
  "mode": "write",
  "candidate_ref": null,
  "state": "READY",
  "bindings": [
    {
      "instance_id": "writer-1",
      "agent_id": "synthetic-writer"
    },
    {
      "instance_id": "integration-owner",
      "agent_id": "synthetic-main"
    }
  ],
  "candidate_writers": [
    "writer-1"
  ],
  "writer_history_ref": {
    "uri": "urn:fixture:synthetic-writer-history",
    "revision": "history-v1",
    "observed_at": "2026-09-05T00:00:00Z"
  },
  "integration_owner": "integration-owner",
  "consumers": [
    "integration-owner"
  ],
  "analysis_scope": [],
  "scratch_paths": [],
  "runtime_refs": {
    "ownership": {
      "uri": "urn:fixture:synthetic-ownership",
      "revision": "ownership-v1",
      "observed_at": "2026-09-05T00:00:00Z"
    },
    "permissions": {
      "uri": "urn:fixture:synthetic-permissions",
      "revision": "permissions-v1",
      "observed_at": "2026-09-05T00:00:00Z"
    }
  },
  "previous_attempt": null
}
