{
  "kind": "assignment",
  "schema_version": "0.1.0",
  "source": {"uri": "urn:synthetic:notification:assignment", "revision": "synthetic-assignment-v1", "observed_at": "2000-01-01T00:00:00Z"},
  "task_ref": {"uri": "urn:synthetic:notification:task", "revision": "synthetic-task-v1", "observed_at": "2000-01-01T00:00:00Z"},
  "task_id": "synthetic-notification-handoff",
  "task_revision": "synthetic-task-v1",
  "run_id": "synthetic-notification-run-1",
  "producer": {"role": "backend-worker", "instance_id": "synthetic-implementation-1"},
  "attempt_id": "synthetic-attempt-1",
  "ownership_epoch": 1,
  "base_ref": "synthetic:base-v1",
  "mode": "write",
  "candidate_ref": null,
  "state": "RUNNING",
  "bindings": [
    {"instance_id": "synthetic-coordinator-1", "agent_id": "synthetic-agent-coordinator"},
    {"instance_id": "synthetic-implementation-1", "agent_id": "synthetic-agent-implementation"},
    {"instance_id": "synthetic-designer-1", "agent_id": "synthetic-agent-designer"},
    {"instance_id": "synthetic-verifier-1", "agent_id": "synthetic-agent-verifier"}
  ],
  "candidate_writers": ["synthetic-coordinator-1", "synthetic-designer-1", "synthetic-implementation-1"],
  "writer_history_ref": {"uri": "urn:synthetic:notification:writer-history", "revision": "synthetic-history-v1", "observed_at": "2000-01-01T00:00:00Z"},
  "integration_owner": "synthetic-coordinator-1",
  "consumers": ["synthetic-coordinator-1", "synthetic-verifier-1"],
  "analysis_scope": [],
  "scratch_paths": [],
  "runtime_refs": {
    "ownership": {"uri": "urn:synthetic:notification:ownership-not-observed", "revision": "synthetic-ownership-v1", "observed_at": "2000-01-01T00:00:00Z"},
    "permissions": {"uri": "urn:synthetic:notification:permissions-not-observed", "revision": "synthetic-permissions-v1", "observed_at": "2000-01-01T00:00:00Z"}
  },
  "previous_attempt": null
}
